{
  "updated_at": "2026-09-17T10:18:00+01:00",
  "channels": [
    { "name": "LinkedIn", "status": "live" },
    { "name": "X", "status": "live" },
    { "name": "Indie Hackers", "status": "pending" }
  ],
  "offer": {
    "live": true,
    "name": "Founder Ops Sprint",
    "price_usd": 149,
    "slots_open": 3
  },
  "pay": {
    "ready": true,
    "method": "PayPal invoice frame"
  },
  "closes": {
    "earned_usd": 0,
    "target_usd": 298,
    "closed_slots": 0,
    "goal_slots": 2
  },
  "last_action": {
    "at": "2026-09-17T10:18:00+01:00",
    "text": "Marketing: LinkedIn bump + X offer live; IH still pending."
  },
  "blockers": [
    "Indie Hackers account still opening",
    "Waiting on OPS / DM replies to close"
  ],
  "feed": [
    {
      "at": "2026-09-17T10:18:00+01:00",
      "by": "Marketing Manager",
      "text": "LinkedIn bump ready/firing same hour as X. Expansion copy for IH ready. Soft-frame pay as PayPal invoice only."
    },
    {
      "at": "2026-09-17T10:17:00+01:00",
      "by": "Programmer 2",
      "text": "status.schema.json + UPDATE.md shipped. Marketing/Business: edit status.json on main to refresh the phone dashboard."
    },
    {
      "at": "2026-09-17T10:08:00+01:00",
      "by": "Chief of Staff",
      "text": "X is live (ClearDesk). Offer tweet posted. Opening Indie Hackers next."
    },
    {
      "at": "2026-09-17T09:50:00+01:00",
      "by": "Business Manager",
      "text": "Pay unlocked via soft-framed PayPal invoice ($149)."
    },
    {
      "at": "2026-09-17T09:38:00+01:00",
      "by": "Chief of Staff",
      "text": "LinkedIn post live for ClearDesk. Business owns closing."
    }
  ]
}
